Date,Post topic,Category,Caption,Image file,Status,Buffer status,Published date
2026-07-27,"How bringing in a third party keeps the customer relationship intact",Educational,,,PLANNED,,
2026-07-28,"Simple credit-control habits that reduce late payments",Cashflow & credit-control tips,,,PLANNED,,
2026-07-30,"Proof point: £110M+ recovered for 3,500+ UK businesses since 2019",Trust & credibility,,,PLANNED,,
2026-07-31,"Myth: debt recovery has to be aggressive (our firm-fair-friendly approach)",Myth-busting,,,PLANNED,,
2026-08-04,"Service spotlight: what tracing is and when it helps",Service spotlights,,,PLANNED,,
